{
  "plan_id": "plan-1",
  "schema_version": "open-cot.execution-plan.v1",
  "project_id": "project-1",
  "plan_version": "v1",
  "goal": "Summarize repository status.",
  "tasks": [
    {
      "task_id": "task-1",
      "title": "Read repository status",
      "objective": "Use a read-only endpoint to inspect repository status.",
      "allowed_scopes": ["project:read"],
      "allowed_capabilities": ["status"],
      "max_risk_level": "read"
    }
  ],
  "assumptions": ["Repository read access is available."]
}
